id,question
926,Write a function to calculate the height of the given binary tree.
927,Write a function to convert a date of yyyy-mm-dd format to dd-mm-yyyy format.
928,Write a function to count repeated items of a tuple.
929,Write a function that matches a string that has an a followed by zero or more b's by using regex.
930,Write a function to calculate the sum of series 1³+2³+3³+….+n³.
931,Write a function to remove duplicate words from a given list of strings.
932,Write a function to convert camel case string to snake case string by using regex.
933,Write a function to find the nth delannoy number.
934,Write a function to calculate the sum of series 1²+2²+3²+….+n².
935,Write a function to re-arrange the given tuples based on the given ordered list.
936,Write a function to count the most common character in a given string.
937,Write a function to find three closest elements from three sorted arrays.
938,Write a function to sort a list of dictionaries using lambda function.
939,Write a function to sort the given array by using heap sort.
940,Write a function to count the elements in a list until an element is a tuple.
941,Write a function to check if any list element is present in the given list.
942,Write a function to combine two given sorted lists using heapq module.
943,Write a function to separate and print the numbers and their position of a given string.
944,Write a function to convert the given tuples into set.
945,Write a function to find the most common elements and their counts of a specified text.
946,Write a python function to find the length of the shortest word.
947,Write a function to get an item of a tuple.
948,Write a function to sort the given tuple list basis the total digits in tuple.
949,Write a function to display sign of the chinese zodiac for given year.
950,Write a function to find the maximum of similar indices in two lists of tuples.
951,Write a function to compute the value of ncr mod p.
952,Write a python function to find the minimun number of subsets with distinct elements.
953,Write a function that gives profit amount if the given amount has profit else return none.
954,"Write a function to find out, if the given number is abundant."
955,Write a function to split the given string at uppercase letters by using regex.
956,Write a python function to get the position of rightmost set bit.
957,Write a function to convert an integer into a roman numeral.
958,Write a python function to find the average of a list.
959,Write a function to solve tiling problem.
960,Write a function to convert a roman numeral to an integer.
961,Write a python function to find the sum of all even natural numbers within the range l and r.
962,Write a function to calculate the discriminant value.
963,Write a python function to check whether the length of the word is even or not.
964,Write a function to convert camel case string to snake case string.
965,Write a function to remove an empty tuple from a list of tuples.
966,Write a python function to accept the strings which contains all vowels.
967,Write a python function to find maximum possible value for the given periodic function.
968,Write a function to join the tuples if they have similar initial elements.
969,Write a function to find minimum of two numbers.
970,"Write a function to find the maximum number of segments of lengths a, b and c that can be formed from n."
971,Write a function to concatenate the given two tuples to a nested tuple.
972,Write a python function to left rotate the string.
973,Write a function to find the minimum total path sum in the given triangle.
