id,question
310,Write a python function to set the left most unset bit.
311,Write a function to find the volume of a cone.
312,Write a python function to print positive numbers in a list.
313,Write a function to find out the maximum sum such that no two chosen numbers are adjacent for the given rectangular grid of dimension 2 x n.
314,Write a python function to find the first maximum length of even word.
315,Write a function to find the index of the last occurrence of a given number in a sorted array.
316,Write a function to reflect the modified run-length encoding from a list.
317,Write a python function to find the maximum volume of a cuboid with given sum of sides.
318,Write a function to find all five characters long word in the given string by using regex.
319,Write a function to calculate the difference between the squared sum of first n natural numbers and the sum of squared first n natural numbers.
320,Write a function to find the demlo number for the given number.
321,Write a function to find all index positions of the minimum values in a given list.
322,Write a function to re-arrange the given array in alternating positive and negative items.
323,Write a function to extract the sum of alternate chains of tuples.
324,Write a python function to find the minimum number of squares whose sum is equal to a given number.
325,Write a function to get the word with most number of occurrences in the given strings list.
326,Write a function to print check if the triangle is isosceles or not.
327,Write a function to rotate a given list by specified number of items to the left direction.
328,Write a python function to count negative numbers in a list.
329,"Write a function to find all three, four, five characters long words in the given string by using regex."
330,Write a python function to count unset bits of a given number.
331,Write a function to count character frequency of a given string.
332,Write a python function to sort a list according to the second element in sublist.
333,Write a python function to check whether the triangle is valid or not if sides are given.
334,Write a function to find the sum of arithmetic progression.
335,Write a function to check whether the given month name contains 28 days or not.
336,"Write a function that matches a word at the end of a string, with optional punctuation."
337,Write a python function to count the number of substrings with same first and last characters.
338,Write a python function to find the maximum occuring divisor in an interval.
339,Write a python function to find the sum of the three lowest positive numbers from a given list of numbers.
340,Write a function to convert the given set into ordered tuples.
341,Write a function to find the smallest range that includes at-least one element from each of the given arrays.
342,Write a function to calculate the number of digits and letters in a string.
343,Write a python function to find number of elements with odd factors in a given range.
344,Write a function to find the difference between two consecutive numbers in a given list.
345,"Write a function to find entringer number e(n, k)."
346,Write a python function to count the number of squares in a rectangle.
347,Write a function to count sequences of given length having non-negative prefix sums that can be generated by given values.
348,Write a python function to check whether the given string is a binary string or not.
349,Write a python function to minimize the length of the string by removing occurrence of only one character.
350,Write a python function to find the first element occurring k times in a given array.
351,Write a python function to check whether all the characters in a given string are unique.
352,Write a function to remove a specified column from a given nested list.
353,Write a function to find t-nth term of arithemetic progression.
354,Write a python function to count the number of rectangles in a circle of radius r.
355,Write a function to find the third angle of a triangle using two angles.
356,Write a function to find the maximum element of all the given tuple records.
357,Write a function to find modulo division of two lists using map and lambda function.
358,Write a python function to check whether one root of the quadratic equation is twice of the other or not.
359,Write a function to find the n’th carol number.
360,Write a function to remove empty lists from a given list of lists.
361,Write a python function to find the item with maximum occurrences in a given list.
362,Write a function to add the k elements to each element in the tuple.
363,Write a function to find the number of flips required to make the given binary string a sequence of alternate characters.
364,Write a python function to count the number of digits of a given number.
365,Write a python function to find the largest product of the pair of adjacent elements from a given list of integers.
366,Write a function to check if a binary tree is balanced or not.
367,Write a function to repeat the given tuple n times.
368,Write a function to find the lateral surface area of cuboid
369,Write a function to sort a tuple by its float element.
370,Write a function to find the smallest missing element in a sorted array.
371,Write a function to sort a given list of elements in ascending order using heap queue algorithm.
372,Write a function to find the volume of a cuboid.
373,Write a function to print all permutations of a given string including duplicates.
374,Write a function to round the given number to the nearest multiple of a specific number.
375,Write a function to remove tuple elements that occur more than once and replace the duplicates with some custom value.
376,Write a python function to remove all occurrences of a character in a given string.
377,Write a python function to shift last element to first position in the given list.
378,Write a function to find the surface area of a cuboid.
379,Write a function to generate a two-dimensional array.
380,Write a function to sort a list of lists by a given index of the inner list.
381,Write a function to find the number of rotations in a circularly sorted array.
382,Write a python function to toggle all odd bits of a given number.
383,Write a python function to find the frequency of the smallest value in a given array.
384,Write a function to find the n'th perrin number using recursion.
385,Write a function to find out the minimum no of swaps required for bracket balancing in the given string.
386,Write a python function to check whether the hexadecimal number is even or odd.
387,Write a python function to find the highest power of 2 that is less than or equal to n.
388,Write a function to find the n'th lucas number.
389,Write a function to insert a given string at the beginning of all items in a list.
390,Write a function to convert more than one list to nested dictionary.
391,"Write a function to find the maximum sum possible by using the given equation f(n) = max( (f(n/2) + f(n/3) + f(n/4) + f(n/5)), n)."
392,Write a function to find the list with maximum length using lambda function.
393,Write a function to check if given tuple is distinct or not.
394,Write a python function to find the first non-repeated character in a given string.
395,Write a function to check whether the given string starts and ends with the same character or not using regex.
396,Write a function to find the median of three specific numbers.
397,Write a function to compute the sum of digits of each number of a given list.
398,Write a function to perform the mathematical bitwise xor operation across the given tuples.
399,Write a function to extract the frequency of unique tuples in the given list order irrespective.
400,Write a function to perform index wise addition of tuple elements in the given two nested tuples.
401,Write a function to compute the value of ncr%p.
402,Write a function to check if a url is valid or not using regex.
403,Write a python function to find the minimum of two numbers.
404,Write a function to check whether an element exists within a tuple.
405,Write a python function to find the parity of a given number.
406,Write a function to create the next bigger number by rearranging the digits of a given number.
407,Write a function to find k number of pairs which consist of one element from the first array and one element from the second array.
408,Write a function to find the minimum product from the pairs of tuples within a given list.
409,Write a function to find the minimum value in a given heterogeneous list.
410,Write a function to convert the given snake case string to camel case string by using regex.
411,Write a python function to remove odd numbers from a given list.
412,Write a function to extract the nth element from a given list of tuples.
413,Write a python function to check whether the value exists in a sequence or not.
414,Write a python function to find a pair with highest product from a given array of integers.
415,Write a function to find the maximum sum we can make by dividing number in three parts recursively and summing them up together for the given number.
416,Write a function to find common first element in given list of tuple.
417,Write a python function to find the sublist having maximum length.
418,Write a function to round every number of a given list of numbers and print the total sum multiplied by the length of the list.
419,Write a python function to find the cube sum of first n even natural numbers.
420,Write a function to concatenate each element of tuple by the delimiter.
421,Write a python function to find the average of cubes of first n natural numbers.
422,Write a function to solve gold mine problem.
423,Write a function to extract only the rear index element of each string in the given tuple.
424,Write a function to count the number of sublists containing a particular element.
425,Write a function to filter odd numbers using lambda function.
426,Write a function to convert a date of yyyy-mm-dd format to dd-mm-yyyy format by using regex.
427,Write a function to sort the given array by using shell sort.
428,Write a function to extract the elementwise and tuples from the given two tuples.
429,Write a function to find the directrix of a parabola.
430,Write a function that takes two lists and returns true if they have at least one common element.
431,Write a function to find the median of a trapezium.
432,Write a function to check whether the entered number is greater than the elements of the given array.
433,Write a function that matches a string that has an a followed by one or more b's.
434,Write a python function to find the last digit of a given number.
435,Write a python function to print negative numbers in a list.
436,Write a function to remove odd characters in a string.
437,Write a function to count bidirectional tuple pairs.
438,Write a function to convert a list of multiple integers into a single integer.
439,Write a function to find all adverbs and their positions in a given sentence.
440,Write a function to find the surface area of a cube.
441,Write a function to find the ration of positive numbers in an array of integers.
442,Write a python function to find the largest negative number from the given list.
443,Write a function to trim each tuple by k in the given tuple list.
444,Write a function to perform index wise multiplication of tuple elements in the given two tuples.
445,Write a python function to count the occurence of all elements of list in a tuple.
446,Write a function to find cubes of individual elements in a list using lambda function.
447,Write a function to calculate the sum of perrin numbers.
448,Write a python function to check whether the triangle is valid or not if 3 points are given.
449,Write a function to extract specified size of strings from a give list of string values.
450,Write a function to remove all whitespaces from the given string using regex.
451,Write a function that gives loss amount if the given amount has loss else return none.
452,Write a python function to find the sum of even factors of a number.
453,Write a function that matches a word containing 'z'.
454,Write a function to check whether the given month number contains 31 days or not.
455,Write a function to reverse strings in a given list of string values.
456,Write a python function to find the sublist having minimum length.
457,Write a function to find the area of a rectangle.
458,Write a function to remove uppercase substrings from a given string by using regex.
459,Write a python function to get the first element of each sublist.
460,Write a python function to count the upper case characters in a given string.
461,Write a function to find all possible combinations of the elements of a given list.
462,Write a function to find the maximum product subarray of the given array.
463,Write a function to check if all values are same in a dictionary.
464,Write a function to drop empty items from a given dictionary.
465,Write a function to find the peak element in the given array.
466,Write a python function to convert decimal number to octal number.
467,Write a function to find the maximum product formed by multiplying numbers of an increasing subsequence of that array.
468,Write a function to find the maximum profit earned from a maximum of k stock transactions
469,Write a function to find the pairwise addition of the elements of the given tuples.
470,Write a python function to find remainder of array multiplication divided by n.
471,Write a python function to check whether the given list contains consecutive numbers or not.
472,Write a function to find the tuple intersection of elements in the given tuple list irrespective of their order.
473,Write a function to replace characters in a string.
474,Write a function to sort counter by value.
475,Write a python function to find the sum of the largest and smallest value in a given array.
476,Write a python function to convert the given string to lower case.
477,Write a function to remove lowercase substrings from a given string.
478,Write a python function to find the first digit of a given number.
479,Write a python function to find the maximum occurring character in a given string.
480,Write a function to determine if there is a subset of the given set with sum equal to the given sum.
481,Write a function to find sequences of one upper case letter followed by lower case letters in the given string by using regex.
482,Write a python function to find the first natural number whose factorial is divisible by x.
483,Write a function to remove the matching tuples from the given two tuples.
484,Write a function to find the largest palindromic number in the given array.
485,Write a function to compute binomial probability for the given number.
486,Write a function to sort a list of tuples in increasing order by the last element in each tuple.
487,Write a function to find the area of a pentagon.
488,Write a python function to find the frequency of the largest value in a given array.
489,Write a function to extract all the pairs which are symmetric in the given tuple list.
490,Write a function to find the sum of geometric progression series.
491,Write a function to search an element in the given array by using binary search.
492,"Write a function to calculate a grid of hexagon coordinates where function returns a list of lists containing 6 tuples of x, y point coordinates."
493,Write a function to convert the given binary tuple to integer.
494,Write a function to remove lowercase substrings from a given string by using regex.
495,Write a function to find the smallest integers from a given list of numbers using heap queue algorithm.
496,Write a function to find the surface area of a cone.
497,Write a python function to find gcd of two positive integers.
498,Write a function to find the diameter of a circle.
499,Write a function to concatenate all elements of the given list into a string.
500,Write a python function to find common divisor between two numbers in a given pair.
501,Write a python function to find remainder of two numbers.
502,Write a function to add consecutive numbers of a given list.
503,Write a python function to find the cube sum of first n natural numbers.
504,Write a function to move all zeroes to the end of the given array.
505,"Write a function to calculate the permutation coefficient of given p(n, k)."
506,Write a function to remove specific words from a given list.
507,Write a function to check if the common elements between two given lists are in the same order or not.
508,Write a python function to find the average of odd numbers till a given odd number.
509,Write a function to find the number of subsequences having product smaller than k for the given non negative array.
510,Write a python function to find minimum sum of factors of a given number.
511,Write a function to count the element frequency in the mixed nested tuple.
512,Write a function to convert tuple into list by adding the given string after every element.
513,Write a function to find the summation of tuple elements in the given tuple list.
514,Write a function to check if there is a subset with sum divisible by m.
515,Write a function to sort a list of elements using radix sort.
516,Write a python function to find the largest postive number from the given list.
517,Write a function to find the square root of a perfect number.
518,Write a function to calculate volume of a tetrahedron.
519,Write a function to find the lcm of the given array elements.
520,Write a function to print check if the triangle is scalene or not.
521,Write a function to find the longest bitonic subsequence for the given array.
522,"Write a function to check whether a given string has a capital letter, a lower case letter, a number and specified length using lambda function."
523,Write a function to find the sum of maximum increasing subsequence of the given array.
524,Write a python function to check whether two given lines are parallel or not.
525,Write a python function to capitalize first and last letters of each word of a given string.
526,Write a function to find all pairs in an integer array whose sum is equal to a given number.
527,Write a function to find the list of lists with minimum length.
528,Write a function to find the nth jacobsthal-lucas number.
529,Write a function to find the ration of negative numbers in an array of integers.
530,Write a function to find minimum number of coins that make a given value.
531,Write a function to check if the two given strings are permutations of each other.
532,Write a function to remove particular data type elements from the given tuple.
533,Write a function to search a literals string in a string and also find the location within the original string where the pattern occurs.
534,Write a function to find the top or bottom surface area of a cylinder.
535,Write a function to select the nth items of a list.
536,Write a python function to find the first repeated word in a given string.
537,Write a python function to convert a given string list to a tuple.
538,Write a function to create a list containing the power of said number in bases raised to the corresponding number in the index using map function.
539,Write a python function to find the difference between highest and least frequencies in a given array.
540,Write a function to find if the given number is abundant or not.
541,"Write a function to replace all occurrences of spaces, commas, or dots with a colon in the given string by using regex."
542,Write a function to add two numbers and print number of digits of sum.
543,Write a function to flatten the tuple list to a string.
544,Write a python function to toggle only first and last bits of a given number.
545,Write a function to find the last occurrence of a character in a string.
546,Write a python function to find the sum of hamming distances of all consecutive numbers from o to n.
547,Write a function to find the length of the longest increasing subsequence of the given sequence.
548,Write a python function to find the sum of fifth power of first n odd natural numbers.
549,Write a python function to find the maximum element in a sorted and rotated array.
550,Write a function to extract a specified column from a given nested list.
551,Write a python function to check whether a given sequence is linear or not.
552,Write a function to convert the given tuple to a floating-point number.
553,Write a python function to find odd numbers from a mixed list.
554,Write a python function to find the difference between sum of cubes of first n natural numbers and the sum of first n natural numbers.
555,Write a python function to count the pairs with xor as an odd number.
556,Write a function to toggle characters case in a string.
557,Write a python function to find the digit distance between two integers.
558,Write a function to find the largest sum of contiguous subarray in the given array.
559,Write a function to find the union of elements of the given tuples.
560,"Write a function to assign with each element, its pair elements from other similar pairs in the given tuple."
561,Write a python function to find the maximum length of sublist.
562,Write a function to extract values between quotation marks of a string.
563,Write a python function to count unequal element pairs from the given array.
564,Write a python function to split a string into characters.
565,Write a function to get the sum of a non-negative integer.
566,Write a function to check whether a specified list is sorted or not.
567,Write a function to create a list of empty dictionaries.
568,Write a function to sort each sublist of strings in a given list of lists.
569,Write a function to remove words from a given list of strings containing a character or string.
570,Write a function to find maximum possible sum of disjoint pairs for the given array of integers and a number k.
571,Write a python function to remove two duplicate numbers from a given number of lists.
572,Write a python function to calculate the product of the unique numbers of a given list.
573,Write a function to find the surface area of a cylinder.
574,Write a python function to find nth number in a sequence which is not a multiple of a given number.
575,Write a python function to check whether an array is subarray of another or not.
576,Write a python function to find the last digit in factorial of a given number.
577,Write a function to interleave lists of the same length.
578,Write a function to find the dissimilar elements in the given two tuples.
579,Write a function to extract the even elements in the nested mixed tuple.
580,Write a python function to find the surface area of the square pyramid.
581,Write a function to check if a dictionary is empty or not.
582,Write a function for nth catalan number.
583,Write a function to find all adverbs and their positions in a given sentence by using regex.
584,Write a function to find the n - expensive price items from a given dataset using heap queue algorithm.
585,Write a python function to split the array and add the first part to the end.
586,Write a function to convert a list to a tuple.
587,Write a python function to find the difference between largest and smallest value in a given array.
588,Write a function to find perfect squares between two given numbers.
589,Write a function to convert polar coordinates to rectangular coordinates.
590,Write a python function to interchange the first and last elements in a list.
591,Write a python function to find sum of product of binomial co-efficients.
592,Write a function to remove leading zeroes from an ip address.
593,Write a function to find the difference of first even and odd number of a given list.
594,Write a python function to count minimum number of swaps required to convert one binary string to another.
595,Write a function to find the size of the given tuple.
596,Write a function to find kth element from the given two sorted arrays.
597,Write a function to check whether the given number is armstrong or not.
598,Write a function to find sum and average of first n natural numbers.
599,Write a python function to check whether the given number is even or not using bitwise operator.
600,Write a function to find the longest chain which can be formed from the given set of pairs.
601,Write a python function to find the first repeated character in a given string.
602,Write a function to get a lucid number smaller than or equal to n.
603,Write a function to reverse words in a given string.
604,Write a function to check if the given integer is a prime number.
605,Write a function to convert degrees to radians.
606,Write a function to search a literals string in a string and also find the location within the original string where the pattern occurs by using regex.
607,Write a python function to find nth bell number.
608,Write a python function to find minimum possible value for the given periodic function.
609,Write a python function to remove the k'th element from a given list.
610,Write a function to find the maximum of nth column from the given tuple list.
611,Write a python function to merge the first and last elements separately in a list of lists.
612,Write a function to find the maximum value in record list as tuple attribute in the given tuple list.
613,Write a function to find the cumulative sum of all the values that are present in the given tuple list.
614,Write a function to find average value of the numbers in a given tuple of tuples.
615,Write a function to perfom the modulo of tuple elements in the given two tuples.
616,"Write a function to check for the number of jumps required of given length to reach a point of form (d, 0) from origin in a 2d plane."
617,Write a function to divide two lists using map and lambda function.
618,Write a function to move all the numbers in it to the given string.
619,Write a function to find the largest subset where each pair is divisible.
